How are you feeling now that you got the promotion? 	John10	<img src='John10.png' />	[sound:Level-C1-1012575965.mp3]	H_w   a_e   y_u   f_e_i_g   n_w   t_a_   <br>y_u   g_t   t_e   p_o_o_i_n?      <br>	Como você está se sentindo agora que recebeu a promoção?	I'm feeling ok. Before my promotion, my colleagues and I would eat lunch together. Now they seem uncomfortable around me. But with my salary, soon I'll be able to afford a new car	Matthew10	<img src=Matthew10.png />	[sound:Level-C1-654261853.mp3]	I'm   f_e_i_g   o_.   B_f_r_   m_   p_o_o_i_n,   <br>m_   c_l_e_g_e_   a_d   I   w_u_d   <br>e_t   l_n_h   t_g_t_e_.   N_w   t_e_   <br>s_e_   u_c_m_o_t_b_e   a_o_n_   m_.   B_t   <br>w_t_   m_   s_l_r_,   s_o_   I'l_   <br>b_   a_l_   t_   a_f_r_   a   <br>n_w   c_r   	Estou me sentindo bem. Antes da minha promoção, meus colegas e eu almoçávamos juntos. Agora eles parecem desconfortáveis ​​perto de mim. Mas com meu salário, em breve poderei comprar um carro novo		Complete abaixo em inglês:		<img src="Tag.png">	<img src="3xwiser.png">	<img src="talk.png">	➤Level-C1 ♥18-What-did-it-use-to-be-like? ⚑Would:-Past-Actions 	Level-C1-1012575965.mp3	Level-C1-654261853.mp3				
What are the differences between now that you have a child and before when you didn't have him?	Eva10	<img src='Eva10.png' />	[sound:Level-C1-854084170.mp3]	W_a_   a_e   t_e   d_f_e_e_c_s   b_t_e_n   n_w   <br>t_a_   y_u   h_v_   a   c_i_d   <br>a_d   b_f_r_   w_e_   y_u   d_d_'_   <br>h_v_   h_m?   	Quais são as diferenças entre agora que vocês têm um filho e antes quando vocês não o tinham?	Before my wife and I had our baby, we would go out whenever we wanted. We can't do that now. I didn't use to be a worrier, I am now 	Matthew10	<img src=Matthew10.png />	[sound:Level-C1-886472702.mp3]	B_f_r_   m_   w_f_   a_d   I   h_d   <br>o_r   b_b_,   w_   w_u_d   g_   <br>o_t   w_e_e_e_   w_   w_n_e_.   W_   <br>c_n't   d_   t_a_   n_w.   I   <br>d_d_'_   u_e   t_   b_   a   <br>w_r_i_r,   I   a_   n_w      <br>	Antes de minha esposa e eu termos nosso bebê, saíamos sempre que queríamos. Não podemos fazer isso agora. Eu não costumava me preocupar, agora me preocupo		Complete abaixo em inglês:		<img src="Tag.png">	<img src="3xwiser.png">	<img src="talk.png">	➤Level-C1 ♥18-What-did-it-use-to-be-like? ⚑Would:-Past-Actions ♚	Level-C1-854084170.mp3	Level-C1-886472702.mp3				
What are their plans for the future?	John10	<img src='John10.png' />	[sound:Level-C1-1860794371.mp3]	W_a_   a_e   t_e_r   p_a_s   f_r   t_e   <br>f_t_r_?   	Quais são os planos deles para o futuro?	They used to plan on moving in with their son when they retired. But they have changed their minds. They are going to sell their house and travel the world	Justin10	<img src=Justin10.png />	[sound:Level-C1-1363761004.mp3]	T_e_   u_e_   t_   p_a_   o_   m_v_n_   <br>i_   w_t_   t_e_r   s_n   w_e_   <br>t_e_   r_t_r_d.   B_t   t_e_   h_v_   <br>c_a_g_d   t_e_r   m_n_s.   T_e_   a_e   <br>g_i_g   t_   s_l_   t_e_r   h_u_e   <br>a_d   t_a_e_   t_e   w_r_d   	Eles planejavam morar com o filho quando se aposentassem. Mas eles mudaram de idéia. Eles vão vender sua casa e viajar pelo mundo		Complete abaixo em inglês:		<img src="Tag.png">	<img src="3xwiser.png">	<img src="talk.png">	➤Level-C1 ♥18-What-did-it-use-to-be-like? ⚑Used-to ♚	Level-C1-1860794371.mp3	Level-C1-1363761004.mp3				
How are things going in your job? 	Kendra10	<img src='Kendra10.png' />	[sound:Level-C1-942444358.mp3]	H_w   a_e   t_i_g_   g_i_g   i_   y_u_   <br>j_b?      	Como estão as coisas no seu trabalho?	I was transferred to another department. My new responsibilities are a lot more interesting, but I didn't use to work this much 	John10	<img src=John10.png />	[sound:Level-C1-792979764.mp3]	I   w_s   t_a_s_e_r_d   t_   a_o_h_r   d_p_r_m_n_.   <br>M_   n_w   r_s_o_s_b_l_t_e_   a_e   a   <br>l_t   m_r_   i_t_r_s_i_g,   b_t   I   <br>d_d_'_   u_e   t_   w_r_   t_i_   <br>m_c_      	Fui transferido para outro departamento. Minhas novas responsabilidades são muito mais interessantes, mas eu não costumava trabalhar tanto		Complete abaixo em inglês:		<img src="Tag.png">	<img src="3xwiser.png">	<img src="talk.png">	➤Level-C1 ♥18-What-did-it-use-to-be-like? ⚑Used-to 	Level-C1-942444358.mp3	Level-C1-792979764.mp3				
What's your best memory of your childhood? 	Ana10	<img src='Ana10.png' />	[sound:Level-C1-577757121.mp3]	W_a_'_   y_u_   b_s_   m_m_r_   o_   y_u_   <br>c_i_d_o_d?      	Qual é a sua melhor lembrança da sua infância?	Well, the brass band used to play every Saturday night in the town square. My mom would take me to the concert. I loved it!	Salli10	<img src=Salli10.png />	[sound:Level-C1-539127731.mp3]	W_l_,   t_e   b_a_s   b_n_   u_e_   t_   <br>p_a_   e_e_y   S_t_r_a_   n_g_t   i_   <br>t_e   t_w_   s_u_r_.   M_   m_m   <br>w_u_d   t_k_   m_   t_   t_e   <br>c_n_e_t.   I   l_v_d   i_!   	Bem, a bandinha tocava todo sábado à noite na praça da cidade. Minha mãe me levava para o show. Eu amava!		Complete abaixo em inglês:		<img src="Tag.png">	<img src="3xwiser.png">	<img src="talk.png">	➤Level-C1 ♥18-What-did-it-use-to-be-like? ⚑Would:-Past-Actions ♚	Level-C1-577757121.mp3	Level-C1-539127731.mp3				
Was there anything you never ate when you were a child? 	Kimberly10	<img src='Kimberly10.png' />	[sound:Level-C1-300225605.mp3]	W_s   t_e_e   a_y_h_n_   y_u   n_v_r   a_e   <br>w_e_   y_u   w_r_   a   c_i_d?   <br>   	Havia algo que você nunca comia quando criança?	Yes, there was. When I was I kid I didn't use to eat fish, I hated it. Now I eat it all the time 	John10	<img src=John10.png />	[sound:Level-C1-1822204964.mp3]	Y_s,   t_e_e   w_s.   W_e_   I   w_s   <br>I   k_d   I   d_d_'_   u_e   <br>t_   e_t   f_s_,   I   h_t_d   <br>i_.   N_w   I   e_t   i_   <br>a_l   t_e   t_m_      	Sim, havia. Quando eu era criança, não costumava comer peixe, eu odiava. Agora eu como o tempo todo		Complete abaixo em inglês:		<img src="Tag.png">	<img src="3xwiser.png">	<img src="talk.png">	➤Level-C1 ♥18-What-did-it-use-to-be-like? ⚑Used-to 	Level-C1-300225605.mp3	Level-C1-1822204964.mp3				
There didn't use to be a supermarket there. When did it open?	Justin10	<img src='Justin10.png' />	[sound:Level-C1-696339935.mp3]	T_e_e   d_d_'_   u_e   t_   b_   a   <br>s_p_r_a_k_t   t_e_e.   W_e_   d_d   i_   <br>o_e_?   	Não costumava haver um supermercado lá. Quando foi aberto?	It was open two weeks ago. People from that neighborhood were glad!	Kimberly10	<img src=Kimberly10.png />	[sound:Level-C1-899344039.mp3]	I_   w_s   o_e_   t_o   w_e_s   a_o.   <br>P_o_l_   f_o_   t_a_   n_i_h_o_h_o_   w_r_   <br>g_a_!   	Foi aberto há duas semanas. As pessoas daquele bairro ficaram felizes!		Complete abaixo em inglês:		<img src="Tag.png">	<img src="3xwiser.png">	<img src="talk.png">	➤Level-C1 ♥18-What-did-it-use-to-be-like? ⚑Used-to 	Level-C1-696339935.mp3	Level-C1-899344039.mp3				
Why are you so cranky today? Did I do anything that upset you? 	Kimberly10	<img src='Kimberly10.png' />	[sound:Level-C1-1055905869.mp3]	W_y   a_e   y_u   s_   c_a_k_   t_d_y?   <br>D_d   I   d_   a_y_h_n_   t_a_   <br>u_s_t   y_u?      	Por que você está tão irritado hoje? Eu fiz algo que te chateou?	The thing that I hate is when kids ride their scooters on the sidewalk. Today that happened. One of those kids rolled his scooter over me and I fell down	John10	<img src=John10.png />	[sound:Level-C1-552199843.mp3]	T_e   t_i_g   t_a_   I   h_t_   i_   <br>w_e_   k_d_   r_d_   t_e_r   s_o_t_r_   <br>o_   t_e   s_d_w_l_.   T_d_y   t_a_   <br>h_p_e_e_.   O_e   o_   t_o_e   k_d_   <br>r_l_e_   h_s   s_o_t_r   o_e_   m_   <br>a_d   I   f_l_   d_w_   	O que eu odeio é quando as crianças andam de scooter na calçada. Hoje isso aconteceu. Uma daquelas crianças me atropleou com sua scooter e eu caí		Complete abaixo em inglês:		<img src="Tag.png">	<img src="3xwiser.png">	<img src="talk.png">	➤Level-C1 ♥19-That-really-bugs-me! ⚑Noun-Clauses ♚	Level-C1-1055905869.mp3	Level-C1-552199843.mp3				
What kind of situation really bugs you?	Salli10	<img src='Salli10.png' />	[sound:Level-C1-591594412.mp3]	W_a_   k_n_   o_   s_t_a_i_n   r_a_l_   b_g_   <br>y_u?   	Que tipo de situação te incomoda muito?	Something that bugs me is people who take up two seats in a crowded bus. They just care about themselves!	Justin10	<img src=Justin10.png />	[sound:Level-C1-1686347055.mp3]	S_m_t_i_g   t_a_   b_g_   m_   i_   p_o_l_   <br>w_o   t_k_   u_   t_o   s_a_s   <br>i_   a   c_o_d_d   b_s.   T_e_   <br>j_s_   c_r_   a_o_t   t_e_s_l_e_!   	Algo que me incomoda são as pessoas que ocupam dois lugares em um ônibus lotado. Eles só se importam consigo mesmos!		Complete abaixo em inglês:		<img src="Tag.png">	<img src="3xwiser.png">	<img src="talk.png">	➤Level-C1 ♥19-That-really-bugs-me! ⚑Relative-Clauses 	Level-C1-591594412.mp3	Level-C1-1686347055.mp3				
What's Sheila's biggest pet peeve? 	Matthew10	<img src='Matthew10.png' />	[sound:Level-C1-476627810.mp3]	W_a_'_   S_e_l_'_   b_g_e_t   p_t   p_e_e?      <br>	O que mais irrita a Sheila? 	The thing that she can't stand is co-workers who leave their cell phones ringing on their desks. Once she got mad at me because I did that	Ana10	<img src=Ana10.png />	[sound:Level-C1-1475375473.mp3]	T_e   t_i_g   t_a_   s_e   c_n't   s_a_d   <br>i_   c_-_o_k_r_   w_o   l_a_e   t_e_r   <br>c_l_   p_o_e_   r_n_i_g   o_   t_e_r   <br>d_s_s.   O_c_   s_e   g_t   m_d   <br>a_   m_   b_c_u_e   I   d_d   <br>t_a_   	O que ela não suporta é os colegas de trabalho que deixam seus celulares tocando em suas mesas. Uma vez que ela ficou brava comigo porque eu fiz isso		Complete abaixo em inglês:		<img src="Tag.png">	<img src="3xwiser.png">	<img src="talk.png">	➤Level-C1 ♥19-That-really-bugs-me! ⚑Noun-Clauses ♚	Level-C1-476627810.mp3	Level-C1-1475375473.mp3				
You shouldn't be so mad at them. They just lost track of time. It has already happened to you too 	Kimberly10	<img src='Kimberly10.png' />	[sound:Level-C1-3489125.mp3]	Y_u   s_o_l_n't   b_   s_   m_d   a_   <br>t_e_.   T_e_   j_s_   l_s_   t_a_k   <br>o_   t_m_.   I_   h_s   a_r_a_y   <br>h_p_e_e_   t_   y_u   t_o      <br>	Você não deveria estar tão bravo com eles. Eles apenas perderam a noção do tempo. Já aconteceu com você também	I know, but one thing that bothers me is when my friends don't show up on time for things	Justin10	<img src=Justin10.png />	[sound:Level-C1-895530569.mp3]	I   k_o_,   b_t   o_e   t_i_g   t_a_   <br>b_t_e_s   m_   i_   w_e_   m_   <br>f_i_n_s   d_n't   s_o_   u_   o_   <br>t_m_   f_r   t_i_g_   	Eu sei, mas uma coisa que me incomoda é quando meus amigos não aparecem a tempo para as coisas		Complete abaixo em inglês:		<img src="Tag.png">	<img src="3xwiser.png">	<img src="talk.png">	➤Level-C1 ♥19-That-really-bugs-me! ⚑Relative-Clauses 	Level-C1-3489125.mp3	Level-C1-895530569.mp3				
What are your neighbors like? Because some of mine are driving me crazy! 	Salli10	<img src='Salli10.png' />	[sound:Level-C1-1434953548.mp3]	W_a_   a_e   y_u_   n_i_h_o_s   l_k_?   B_c_u_e   <br>s_m_   o_   m_n_   a_e   d_i_i_g   <br>m_   c_a_y!      	Como são seus vizinhos? Porque alguns dos meus estão me deixando louca!	Well, my neighbors are pretty nice people. There is just one who really irritates me. He listens to loud music every day. One thing that makes me sick is selfish people	Matthew10	<img src=Matthew10.png />	[sound:Level-C1-1593784606.mp3]	W_l_,   m_   n_i_h_o_s   a_e   p_e_t_   n_c_   <br>p_o_l_.   T_e_e   i_   j_s_   o_e   <br>w_o   r_a_l_   i_r_t_t_s   m_.   H_   <br>l_s_e_s   t_   l_u_   m_s_c   e_e_y   <br>d_y.   O_e   t_i_g   t_a_   m_k_s   <br>m_   s_c_   i_   s_l_i_h   p_o_l_   <br>	Bem, meus vizinhos são pessoas muito legais. Há apenas um que realmente me irrita. Ele ouve música alta todos os dias. Uma coisa que me deixa louco são pessoas egoístas		Complete abaixo em inglês:		<img src="Tag.png">	<img src="3xwiser.png">	<img src="talk.png">	➤Level-C1 ♥19-That-really-bugs-me! ⚑Relative-Clauses 	Level-C1-1434953548.mp3	Level-C1-1593784606.mp3				
If I'm riding a car, something that irritates me is people who don't respect traffic signs	Kendra10	<img src='Kendra10.png' />	[sound:Level-C1-525830577.mp3]	I_   I'm   r_d_n_   a   c_r,   s_m_t_i_g   <br>t_a_   i_r_t_t_s   m_   i_   p_o_l_   <br>w_o   d_n't   r_s_e_t   t_a_f_c   s_g_s   <br>	Se estou andando de carro, algo que me irrita são as pessoas que não respeitam os sinais de trânsito	Absolutely! These people put everyone else in danger. They should realize we're not supposed to be reckless in traffic	Eva10	<img src=Eva10.png />	[sound:Level-C1-1799793351.mp3]	A_s_l_t_l_!   T_e_e   p_o_l_   p_t   e_e_y_n_   e_s_   <br>i_   d_n_e_.   T_e_   s_o_l_   r_a_i_e   <br>w_'_e   n_t   s_p_o_e_   t_   b_   <br>r_c_l_s_   i_   t_a_f_c   	Absolutamente! Essas pessoas colocam todos os outros em perigo. Elas devem perceber que não devemos ser imprudentes no trânsito		Complete abaixo em inglês:		<img src="Tag.png">	<img src="3xwiser.png">	<img src="talk.png">	➤Level-C1 ♥19-That-really-bugs-me! ⚑Relative-Clauses 	Level-C1-525830577.mp3	Level-C1-1799793351.mp3				
What would you do if your neighbor's young son tore up all the flowers in your garden?	Matthew10	<img src='Matthew10.png' />	[sound:Level-C1-1898264244.mp3]	W_a_   w_u_d   y_u   d_   i_   y_u_   <br>n_i_h_o_'_   y_u_g   s_n   t_r_   u_   <br>a_l   t_e   f_o_e_s   i_   y_u_   <br>g_r_e_?   	O que você faria se o filho mais novo do seu vizinho arrancasse todas as flores do seu jardim?	I probably wouldn't say anything to the child, after all, children are not entirely aware of their actions. However, I would talk to his parents and make sure that never happens again. One thing that really gets under my skin is when parents do not rear their kids to respect others	Ana10	<img src=Ana10.png />	[sound:Level-C1-1170003988.mp3]	I   p_o_a_l_   w_u_d_'_   s_y   a_y_h_n_   t_   <br>t_e   c_i_d,   a_t_r   a_l,   c_i_d_e_   <br>a_e   n_t   e_t_r_l_   a_a_e   o_   <br>t_e_r   a_t_o_s.   H_w_v_r,   I   w_u_d   <br>t_l_   t_   h_s   p_r_n_s   a_d   <br>m_k_   s_r_   t_a_   n_v_r   h_p_e_s   <br>a_a_n.   O_e   t_i_g   t_a_   r_a_l_   <br>g_t_   u_d_r   m_   s_i_   i_   <br>w_e_   p_r_n_s   d_   n_t   r_a_   <br>t_e_r   k_d_   t_   r_s_e_t   o_h_r_   <br>	Eu provavelmente não diria nada à criança, afinal, as crianças não estão totalmente conscientes de suas ações. No entanto, eu conversaria com seus pais e me certificaria de que isso nunca mais acontecesse. Uma coisa que realmente me irrita é quando os pais não criam seus filhos para respeitar os outros		Complete abaixo em inglês:		<img src="Tag.png">	<img src="3xwiser.png">	<img src="talk.png">	➤Level-C1 ♥19-That-really-bugs-me! ⚑Noun-Clauses ♚	Level-C1-1898264244.mp3	Level-C1-1170003988.mp3				
What would you do if you saw someone littering in a public park?	Eva10	<img src='Eva10.png' />	[sound:Level-C1-866180004.mp3]	W_a_   w_u_d   y_u   d_   i_   y_u   <br>s_w   s_m_o_e   l_t_e_i_g   i_   a   <br>p_b_i_   p_r_?   	O que você faria se visse alguém jogando lixo em um parque público?	Well, I'd possibly ask the person politely to not do that. If it didn't work, I'd take a picture and show it to the local authorities. The thing that drives me up the wall is people who don't care about the environment	John10	<img src=John10.png />	[sound:Level-C1-798557195.mp3]	W_l_,   I'd   p_s_i_l_   a_k   t_e   p_r_o_   <br>p_l_t_l_   t_   n_t   d_   t_a_.   <br>I_   i_   d_d_'_   w_r_,   I'd   <br>t_k_   a   p_c_u_e   a_d   s_o_   <br>i_   t_   t_e   l_c_l   a_t_o_i_i_s.   <br>T_e   t_i_g   t_a_   d_i_e_   m_   <br>u_   t_e   w_l_   i_   p_o_l_   <br>w_o   d_n't   c_r_   a_o_t   t_e   <br>e_v_r_n_e_t   	Bem, eu provavelmente pediria educadamente à pessoa para não fazer isso. Se não desse certo, eu tiraria uma foto e mostraria às autoridades locais. O que mais me dá nos nervos são as pessoas que não se importam com o meio ambiente		Complete abaixo em inglês:		<img src="Tag.png">	<img src="3xwiser.png">	<img src="talk.png">	➤Level-C1 ♥19-That-really-bugs-me! ⚑Noun-Clauses 	Level-C1-866180004.mp3	Level-C1-798557195.mp3				
Yesterday I was at the bank and I was waiting in line for a long time. Suddenly, a young man cut in front of me! I lost my mind and argued with him	Kimberly10	<img src='Kimberly10.png' />	[sound:Level-C1-760633886.mp3]	Y_s_e_d_y   I   w_s   a_   t_e   b_n_   <br>a_d   I   w_s   w_i_i_g   i_   <br>l_n_   f_r   a   l_n_   t_m_.   <br>S_d_e_l_,   a   y_u_g   m_n   c_t   <br>i_   f_o_t   o_   m_!   I   <br>l_s_   m_   m_n_   a_d   a_g_e_   <br>w_t_   h_m   	Ontem eu estava no banco e fiquei na fila por um longo tempo. De repente, um jovem passou na minha frente! Eu perdi a cabeça e discuti com ele	If I were in your shoes, I don't know if I would have argued with him. But I would certainly have said something. One thing that I hate is when people don't regard for others	Justin10	<img src=Justin10.png />	[sound:Level-C1-123503554.mp3]	I_   I   w_r_   i_   y_u_   s_o_s,   <br>I   d_n't   k_o_   i_   I   <br>w_u_d   h_v_   a_g_e_   w_t_   h_m.   <br>B_t   I   w_u_d   c_r_a_n_y   h_v_   <br>s_i_   s_m_t_i_g.   O_e   t_i_g   t_a_   <br>I   h_t_   i_   w_e_   p_o_l_   <br>d_n't   r_g_r_   f_r   o_h_r_   	Se eu estivesse no seu lugar, não sei se teria discutido com ele. Mas eu certamente teria dito alguma coisa. Uma coisa que eu odeio é quando as pessoas não respeitam os outros		Complete abaixo em inglês:		<img src="Tag.png">	<img src="3xwiser.png">	<img src="talk.png">	➤Level-C1 ♥19-That-really-bugs-me! ⚑Relative-Clauses ♚	Level-C1-760633886.mp3	Level-C1-123503554.mp3				
Can you tell me more about your pet peeves? They're very unusual! 	Eva10	<img src='Eva10.png' />	[sound:Level-C1-429385419.mp3]	C_n   y_u   t_l_   m_   m_r_   a_o_t   <br>y_u_   p_t   p_e_e_?   T_e_'_e   v_r_   <br>u_u_u_l!      	Você pode me dizer mais sobre suas irritações? Eles são muito incomuns!	Well, another thing I hate is when people laugh at their own jokes and they're not funny. It really gets my goat!	Salli10	<img src=Salli10.png />	[sound:Level-C1-1467415735.mp3]	W_l_,   a_o_h_r   t_i_g   I   h_t_   i_   <br>w_e_   p_o_l_   l_u_h   a_   t_e_r   <br>o_n   j_k_s   a_d   t_e_'_e   n_t   <br>f_n_y.   I_   r_a_l_   g_t_   m_   <br>g_a_!   	Bem, outra coisa que eu odeio é quando as pessoas riem de suas próprias piadas e elas não são engraçadas. Isso me irrita muito!		Complete abaixo em inglês:		<img src="Tag.png">	<img src="3xwiser.png">	<img src="talk.png">	➤Level-C1 ♥19-That-really-bugs-me! ⚑Noun-Clauses ♚	Level-C1-429385419.mp3	Level-C1-1467415735.mp3				
Last week I had to teach my niece how to chew gum. Every time she chews one, she makes loud noises 	Kendra10	<img src='Kendra10.png' />	[sound:Level-C1-634737684.mp3]	L_s_   w_e_   I   h_d   t_   t_a_h   <br>m_   n_e_e   h_w   t_   c_e_   <br>g_m.   E_e_y   t_m_   s_e   c_e_s   <br>o_e,   s_e   m_k_s   l_u_   n_i_e_   <br>   	Na semana passada, tive que ensinar minha sobrinha como mascar chiclete. Toda vez que ela mastiga um, ela faz barulhos altos	This is so annoying, right? People who chew gum loudly get on my nerves	Salli10	<img src=Salli10.png />	[sound:Level-C1-2089281491.mp3]	T_i_   i_   s_   a_n_y_n_,   r_g_t?   P_o_l_   <br>w_o   c_e_   g_m   l_u_l_   g_t   <br>o_   m_   n_r_e_   	Isso é tão chato, né? As pessoas que mascam chiclete fazendo barulhos altos me dão nos nervos		Complete abaixo em inglês:		<img src="Tag.png">	<img src="3xwiser.png">	<img src="talk.png">	➤Level-C1 ♥19-That-really-bugs-me! ⚑Relative-Clauses 	Level-C1-634737684.mp3	Level-C1-2089281491.mp3				
The town fined my neighbor who burns garbage in her backyard. I liked it! 	Matthew10	<img src='Matthew10.png' />	[sound:Level-C1-959227291.mp3]	T_e   t_w_   f_n_d   m_   n_i_h_o_   w_o   <br>b_r_s   g_r_a_e   i_   h_r   b_c_y_r_.   <br>I   l_k_d   i_!      	A cidade multou minha vizinha que queima lixo em seu quintal. Eu gostei disso!	Don't people know that burning garbage is terrible for the health of our lungs? After all, the ashes go into the air we breathe	Justin10	<img src=Justin10.png />	[sound:Level-C1-2096574556.mp3]	D_n't   p_o_l_   k_o_   t_a_   b_r_i_g   g_r_a_e   <br>i_   t_r_i_l_   f_r   t_e   h_a_t_   <br>o_   o_r   l_n_s?   A_t_r   a_l,   <br>t_e   a_h_s   g_   i_t_   t_e   <br>a_r   w_   b_e_t_e   	As pessoas não sabem que queimar lixo é terrível para a saúde de nossos pulmões? Afinal, as cinzas vão para o ar que respiramos		Complete abaixo em inglês:		<img src="Tag.png">	<img src="3xwiser.png">	<img src="talk.png">	➤Level-C1 ♥19-That-really-bugs-me! ⚑Relative-Clauses 	Level-C1-959227291.mp3	Level-C1-2096574556.mp3				
What truly irritates you? 	John10	<img src='John10.png' />	[sound:Level-C1-317999032.mp3]	W_a_   t_u_y   i_r_t_t_s   y_u?      	O que realmente te irrita?	One thing that gets me down is people who lie to me. I can't stand lies!	Kendra10	<img src=Kendra10.png />	[sound:Level-C1-468754467.mp3]	O_e   t_i_g   t_a_   g_t_   m_   d_w_   <br>i_   p_o_l_   w_o   l_e   t_   <br>m_.   I   c_n't   s_a_d   l_e_!   <br>	Uma coisa que me deixa deprimido são as pessoas que mentem para mim. Eu não suporto mentiras!		Complete abaixo em inglês:		<img src="Tag.png">	<img src="3xwiser.png">	<img src="talk.png">	➤Level-C1 ♥19-That-really-bugs-me! ⚑Noun-Clauses ♚	Level-C1-317999032.mp3	Level-C1-468754467.mp3				
What do you admire most about people?	Eva10	<img src='Eva10.png' />	[sound:Level-C1-2105476092.mp3]	W_a_   d_   y_u   a_m_r_   m_s_   a_o_t   <br>p_o_l_?   	O que você mais admira nas pessoas?	I like people who stand up for something they believe in	Kimberly10	<img src=Kimberly10.png />	[sound:Level-C1-355646783.mp3]	I   l_k_   p_o_l_   w_o   s_a_d   u_   <br>f_r   s_m_t_i_g   t_e_   b_l_e_e   i_   <br>	Eu gosto de pessoas que defendem algo em que acreditam		Complete abaixo em inglês:		<img src="Tag.png">	<img src="3xwiser.png">	<img src="talk.png">	➤Level-C1 ♥19-That-really-bugs-me! ⚑Relative-Clauses 	Level-C1-2105476092.mp3	Level-C1-355646783.mp3				
Something I can't do is keep up with technology. It's hard for me to understand how it works	Kimberly10	<img src='Kimberly10.png' />	[sound:Level-C1-791912959.mp3]	S_m_t_i_g   I   c_n't   d_   i_   k_e_   <br>u_   w_t_   t_c_n_l_g_.   I_'_   h_r_   <br>f_r   m_   t_   u_d_r_t_n_   h_w   <br>i_   w_r_s   	Algo que não consigo fazer é acompanhar a tecnologia. É difícil para eu entender como funciona	I can help you with that. I really like everything related to technology and I can teach you how to use it 	John10	<img src=John10.png />	[sound:Level-C1-1020548828.mp3]	I   c_n   h_l_   y_u   w_t_   t_a_.   <br>I   r_a_l_   l_k_   e_e_y_h_n_   r_l_t_d   <br>t_   t_c_n_l_g_   a_d   I   c_n   <br>t_a_h   y_u   h_w   t_   u_e   <br>i_      	Eu posso te ajudar com isso. Eu realmente gosto de tudo relacionado à tecnologia e posso te ensinar a usá-la		Complete abaixo em inglês:		<img src="Tag.png">	<img src="3xwiser.png">	<img src="talk.png">	➤Level-C1 ♥19-That-really-bugs-me! ⚑Relative-Clauses 	Level-C1-791912959.mp3	Level-C1-1020548828.mp3				
