What do you do to relax after a tough day at work?	Salli10	<img src='Salli10.png' />	[sound:Level-C1-1790657182.mp3]	W_a_   d_   y_u   d_   t_   r_l_x   <br>a_t_r   a   t_u_h   d_y   a_   <br>w_r_?   	O que você faz para relaxar após um dia difícil no trabalho?	I like to listen to music at night. So, I play a calm instrumental song, I drink some tea and then I get ready for a full night of deep sleep	John10	<img src=John10.png />	[sound:Level-C1-881542748.mp3]	I   l_k_   t_   l_s_e_   t_   m_s_c   <br>a_   n_g_t.   S_,   I   p_a_   <br>a   c_l_   i_s_r_m_n_a_   s_n_,   I   <br>d_i_k   s_m_   t_a   a_d   t_e_   <br>I   g_t   r_a_y   f_r   a   <br>f_l_   n_g_t   o_   d_e_   s_e_p   <br>	Eu gosto de ouvir música à noite. Então, eu toco uma música instrumental calma, tomo um chá e me preparo para uma noite inteira de sono pesado		Complete abaixo em inglês:		<img src="Tag.png">	<img src="3xwiser.png">	<img src="talk.png">	➤Level-C1 ♥07-What's-your-best-time-of-the-day? ⚑WH-Questions 	Level-C1-1790657182.mp3	Level-C1-881542748.mp3				
When do you like studying for an exam?	Justin10	<img src='Justin10.png' />	[sound:Level-C1-1403661635.mp3]	W_e_   d_   y_u   l_k_   s_u_y_n_   f_r   <br>a_   e_a_?   	Quando que você gosta de estudar para uma prova?	I really like to study for exams early in the morning. At night I'm really tired, so I prefer to sleep early and study before going to school	Eva10	<img src=Eva10.png />	[sound:Level-C1-583727052.mp3]	I   r_a_l_   l_k_   t_   s_u_y   f_r   <br>e_a_s   e_r_y   i_   t_e   m_r_i_g.   <br>A_   n_g_t   I'm   r_a_l_   t_r_d,   <br>s_   I   p_e_e_   t_   s_e_p   <br>e_r_y   a_d   s_u_y   b_f_r_   g_i_g   <br>t_   s_h_o_   	Eu gosto muito de estudar para os exames de manhã cedo. À noite estou muito cansada, então prefiro dormir cedo e estudar antes de ir para a escola		Complete abaixo em inglês:		<img src="Tag.png">	<img src="3xwiser.png">	<img src="talk.png">	➤Level-C1 ♥07-What's-your-best-time-of-the-day? ⚑WH-Questions 	Level-C1-1403661635.mp3	Level-C1-583727052.mp3				
I struggle to work on difficult tasks, what do you do to make it easier?	Salli10	<img src='Salli10.png' />	[sound:Level-C1-786140135.mp3]	I   s_r_g_l_   t_   w_r_   o_   d_f_i_u_t   <br>t_s_s,   w_a_   d_   y_u   d_   <br>t_   m_k_   i_   e_s_e_?   	Eu me esforço quando trabalho em tarefas difíceis, o que você faz para facilitar?	While working on a difficult task, I like to take a break and relax for five minutes, every hour	Ana10	<img src=Ana10.png />	[sound:Level-C1-1391181467.mp3]	W_i_e   w_r_i_g   o_   a   d_f_i_u_t   t_s_,   <br>I   l_k_   t_   t_k_   a   <br>b_e_k   a_d   r_l_x   f_r   f_v_   <br>m_n_t_s,   e_e_y   h_u_   	Enquanto trabalho em uma tarefa difícil, gosto de fazer uma pausa e relaxar por cinco minutos, a cada hora		Complete abaixo em inglês:		<img src="Tag.png">	<img src="3xwiser.png">	<img src="talk.png">	➤Level-C1 ♥07-What's-your-best-time-of-the-day? ⚑Time-clauses 	Level-C1-786140135.mp3	Level-C1-1391181467.mp3				
How do you start your mornings?	Kendra10	<img src='Kendra10.png' />	[sound:Level-C1-130681496.mp3]	H_w   d_   y_u   s_a_t   y_u_   m_r_i_g_?   <br>	Como você começa suas manhãs?	I don't feel awake in the morning until I've had my cup of coffee and taken my shower. Then my mornings start!	John10	<img src=John10.png />	[sound:Level-C1-70688881.mp3]	I   d_n't   f_e_   a_a_e   i_   t_e   <br>m_r_i_g   u_t_l   I'v_   h_d   m_   <br>c_p   o_   c_f_e_   a_d   t_k_n   <br>m_   s_o_e_.   T_e_   m_   m_r_i_g_   <br>s_a_t!   	Não me sinto acordado de manhã até tomar minha xícara de café e tomar banho. Então minhas manhãs começam!		Complete abaixo em inglês:		<img src="Tag.png">	<img src="3xwiser.png">	<img src="talk.png">	➤Level-C1 ♥07-What's-your-best-time-of-the-day? ⚑Time-clauses 	Level-C1-130681496.mp3	Level-C1-70688881.mp3				
What do you do when you have trouble sleeping?	Matthew10	<img src='Matthew10.png' />	[sound:Level-C1-58972667.mp3]	W_a_   d_   y_u   d_   w_e_   y_u   <br>h_v_   t_o_b_e   s_e_p_n_?   	O que você faz quando tem problemas para dormir?	Whenever I have trouble sleeping I either read a book or listen to some instrumental song. That helps me fall asleep	Kimberly10	<img src=Kimberly10.png />	[sound:Level-C1-968607988.mp3]	W_e_e_e_   I   h_v_   t_o_b_e   s_e_p_n_   I   <br>e_t_e_   r_a_   a   b_o_   o_   <br>l_s_e_   t_   s_m_   i_s_r_m_n_a_   s_n_.   <br>T_a_   h_l_s   m_   f_l_   a_l_e_   <br>	Sempre que tenho problemas para dormir, leio um livro ou ouço uma música instrumental. Isso me ajuda a pegar no sono		Complete abaixo em inglês:		<img src="Tag.png">	<img src="3xwiser.png">	<img src="talk.png">	➤Level-C1 ♥07-What's-your-best-time-of-the-day? ⚑Time-clauses ♚	Level-C1-58972667.mp3	Level-C1-968607988.mp3				
Have you ever burnt out from too much work?	Ana10	<img src='Ana10.png' />	[sound:Level-C1-1008352237.mp3]	H_v_   y_u   e_e_   b_r_t   o_t   f_o_   <br>t_o   m_c_   w_r_?   	Você alguma vez já se esgotou por muito trabalho?	Sure! That's why I started doing yoga classes	Salli10	<img src=Salli10.png />	[sound:Level-C1-785691669.mp3]	S_r_!   T_a_'_   w_y   I   s_a_t_d   d_i_g   <br>y_g_   c_a_s_s   	Claro! Por isso comecei a fazer aulas de ioga		Complete abaixo em inglês:		<img src="Tag.png">	<img src="3xwiser.png">	<img src="talk.png">	➤Level-C1 ♥07-What's-your-best-time-of-the-day? ⚑Time-clauses 	Level-C1-1008352237.mp3	Level-C1-785691669.mp3				
How do you calm down after an argument?	Salli10	<img src='Salli10.png' />	[sound:Level-C1-1737042299.mp3]	H_w   d_   y_u   c_l_   d_w_   a_t_r   <br>a_   a_g_m_n_?   	Como que você se tranquiliza depois de uma discussão?	Oh, I try to get a moment alone and breathe deeply for some minutes	Ana10	<img src=Ana10.png />	[sound:Level-C1-85154791.mp3]	O_,   I   t_y   t_   g_t   a   <br>m_m_n_   a_o_e   a_d   b_e_t_e   d_e_l_   <br>f_r   s_m_   m_n_t_s   	Ah, eu tento ficar um tempo sozinha e respirar profundamente por alguns minutos		Complete abaixo em inglês:		<img src="Tag.png">	<img src="3xwiser.png">	<img src="talk.png">	➤Level-C1 ♥07-What's-your-best-time-of-the-day? ⚑WH-Questions 	Level-C1-1737042299.mp3	Level-C1-85154791.mp3				
How do you chill out after a rough day?	John10	<img src='John10.png' />	[sound:Level-C1-982427018.mp3]	H_w   d_   y_u   c_i_l   o_t   a_t_r   <br>a   r_u_h   d_y?   	Como que você relaxa depois de um dia difícil?	Whenever I have a rough day, I like to chill out drinking a beer and watching TV	Matthew10	<img src=Matthew10.png />	[sound:Level-C1-109603617.mp3]	W_e_e_e_   I   h_v_   a   r_u_h   d_y,   <br>I   l_k_   t_   c_i_l   o_t   <br>d_i_k_n_   a   b_e_   a_d   w_t_h_n_   <br>T_   	Sempre que eu tenho um dia difícil, eu gosto de relaxar bebendo uma cerveja e assistindo TV		Complete abaixo em inglês:		<img src="Tag.png">	<img src="3xwiser.png">	<img src="talk.png">	➤Level-C1 ♥07-What's-your-best-time-of-the-day? ⚑Time-clauses 	Level-C1-982427018.mp3	Level-C1-109603617.mp3				
Do you drop off quickly after you go to bed?	Matthew10	<img src='Matthew10.png' />	[sound:Level-C1-1565450952.mp3]	D_   y_u   d_o_   o_f   q_i_k_y   a_t_r   <br>y_u   g_   t_   b_d?   	Você pega no sono rapidamente depois de ir se deitar?	I usually don't drop off so easily, but after having a rough day, I can drop off in seconds	John10	<img src=John10.png />	[sound:Level-C1-747863563.mp3]	I   u_u_l_y   d_n't   d_o_   o_f   s_   <br>e_s_l_,   b_t   a_t_r   h_v_n_   a   <br>r_u_h   d_y,   I   c_n   d_o_   <br>o_f   i_   s_c_n_s   	Eu geralmente não pego no sono tão facilmente, mas depois de um dia difícil, eu consigo pegar no sono em segundos		Complete abaixo em inglês:		<img src="Tag.png">	<img src="3xwiser.png">	<img src="talk.png">	➤Level-C1 ♥07-What's-your-best-time-of-the-day? ⚑Time-clauses 	Level-C1-1565450952.mp3	Level-C1-747863563.mp3				
How do you perk up when you feel sleepy?	Ana10	<img src='Ana10.png' />	[sound:Level-C1-1353647035.mp3]	H_w   d_   y_u   p_r_   u_   w_e_   <br>y_u   f_e_   s_e_p_?   	Como que você se anima quando você se sente sonolenta?	Whenever I feel sleepy I grab a cup of coffee and eat something sweet	Kendra10	<img src=Kendra10.png />	[sound:Level-C1-294356012.mp3]	W_e_e_e_   I   f_e_   s_e_p_   I   g_a_   <br>a   c_p   o_   c_f_e_   a_d   <br>e_t   s_m_t_i_g   s_e_t   	Quando eu me sinto sonolenta, eu pego uma xícara de café e como alguma coisa doce		Complete abaixo em inglês:		<img src="Tag.png">	<img src="3xwiser.png">	<img src="talk.png">	➤Level-C1 ♥07-What's-your-best-time-of-the-day? ⚑Time-clauses 	Level-C1-1353647035.mp3	Level-C1-294356012.mp3				
Do you race off as soon as class is over?	Eva10	<img src='Eva10.png' />	[sound:Level-C1-938249050.mp3]	D_   y_u   r_c_   o_f   a_   s_o_   <br>a_   c_a_s   i_   o_e_?   	Você sai na disparado assim que a aula acaba?	Of course I do! My favorite TV show starts right after my class, so I need to race off to my house	Justin10	<img src=Justin10.png />	[sound:Level-C1-1535174853.mp3]	O_   c_u_s_   I   d_!   M_   f_v_r_t_   <br>T_   s_o_   s_a_t_   r_g_t   a_t_r   <br>m_   c_a_s,   s_   I   n_e_   <br>t_   r_c_   o_f   t_   m_   <br>h_u_e   	Claro que sim! Meu programa de TV favorito começa logo depois da minha aula, então eu preciso ir ligeiro para casa		Complete abaixo em inglês:		<img src="Tag.png">	<img src="3xwiser.png">	<img src="talk.png">	➤Level-C1 ♥07-What's-your-best-time-of-the-day? ⚑Time-clauses 	Level-C1-938249050.mp3	Level-C1-1535174853.mp3				
How often do you sleep over at a friend's house?	Kimberly10	<img src='Kimberly10.png' />	[sound:Level-C1-572788589.mp3]	H_w   o_t_n   d_   y_u   s_e_p   o_e_   <br>a_   a   f_i_n_'_   h_u_e?   	Com que frequência você dorme na casa de uma amiga?	Whenever my mom lets me	Eva10	<img src=Eva10.png />	[sound:Level-C1-662575505.mp3]	W_e_e_e_   m_   m_m   l_t_   m_   	Sempre que minha mãe me deixa		Complete abaixo em inglês:		<img src="Tag.png">	<img src="3xwiser.png">	<img src="talk.png">	➤Level-C1 ♥07-What's-your-best-time-of-the-day? ⚑Time-clauses 	Level-C1-572788589.mp3	Level-C1-662575505.mp3				
What time do you go to bed on the weekends?	Ana10	<img src='Ana10.png' />	[sound:Level-C1-1087172806.mp3]	W_a_   t_m_   d_   y_u   g_   t_   <br>b_d   o_   t_e   w_e_e_d_?   	Que horas você vai para cama nos finais de semana?	Whenever I have the opportunity to sleep early on the weekends, I do. So I usually turn in at about 10 p.m. on the weekends	Kimberly10	<img src=Kimberly10.png />	[sound:Level-C1-310258299.mp3]	W_e_e_e_   I   h_v_   t_e   o_p_r_u_i_y   t_   <br>s_e_p   e_r_y   o_   t_e   w_e_e_d_,   <br>I   d_.   S_   I   u_u_l_y   <br>t_r_   i_   a_   a_o_t   1_   <br>p.m.   o_   t_e   w_e_e_d_   	Sempre que eu tenho a oportunidade de dormir cedo nos finais de semana, eu durmo. Então eu geralmente vou para cama por volta das 22h nos finais de semana		Complete abaixo em inglês:		<img src="Tag.png">	<img src="3xwiser.png">	<img src="talk.png">	➤Level-C1 ♥07-What's-your-best-time-of-the-day? ⚑Time-clauses ♚	Level-C1-1087172806.mp3	Level-C1-310258299.mp3				
I have been working a lot on this project, and I'm so worn out. I'm worried about my health	Kendra10	<img src='Kendra10.png' />	[sound:Level-C1-1090743931.mp3]	I   h_v_   b_e_   w_r_i_g   a   l_t   <br>o_   t_i_   p_o_e_t,   a_d   I'm   <br>s_   w_r_   o_t.   I'm   w_r_i_d   <br>a_o_t   m_   h_a_t_   	Eu tenho trabalhado muito nesse projeto e eu estou muito esgotada. Estou preocupada com a minha saúde	Well, have you ever thought of telling someone that you need help?	Ana10	<img src=Ana10.png />	[sound:Level-C1-1638214706.mp3]	W_l_,   h_v_   y_u   e_e_   t_o_g_t   o_   <br>t_l_i_g   s_m_o_e   t_a_   y_u   n_e_   <br>h_l_?   	Bom, você já pensou em falar para alguém que você precisa de ajuda?		Complete abaixo em inglês:		<img src="Tag.png">	<img src="3xwiser.png">	<img src="talk.png">	➤Level-C1 ♥07-What's-your-best-time-of-the-day? ⚑Present-Perfect-Continuous 	Level-C1-1090743931.mp3	Level-C1-1638214706.mp3				
Whenever my friend chats with me at night, we chat for hours and hours. The next day I can't keep my eyes open	Kendra10	<img src='Kendra10.png' />	[sound:Level-C1-1165456164.mp3]	W_e_e_e_   m_   f_i_n_   c_a_s   w_t_   m_   <br>a_   n_g_t,   w_   c_a_   f_r   <br>h_u_s   a_d   h_u_s.   T_e   n_x_   <br>d_y   I   c_n't   k_e_   m_   <br>e_e_   o_e_   	Sempre que minha amiga me manda mensagem a noite, nós ficamos converçando por horas e horas. No dia seguinte eu não consigo manter meus olhos abertos	It might not be a bad idea if you turn off your phone at night	Ana10	<img src=Ana10.png />	[sound:Level-C1-343154321.mp3]	I_   m_g_t   n_t   b_   a   b_d   <br>i_e_   i_   y_u   t_r_   o_f   <br>y_u_   p_o_e   a_   n_g_t   	Talvez não seja uma má idéia você desligar o seu telefone à noite		Complete abaixo em inglês:		<img src="Tag.png">	<img src="3xwiser.png">	<img src="talk.png">	➤Level-C1 ♥07-What's-your-best-time-of-the-day? ⚑Time-clauses 	Level-C1-1165456164.mp3	Level-C1-343154321.mp3				
I sometines lie awake at night even if I'm really tired	John10	<img src='John10.png' />	[sound:Level-C1-495244760.mp3]	I   s_m_t_n_s   l_e   a_a_e   a_   n_g_t   <br>e_e_   i_   I'm   r_a_l_   t_r_d   <br>	Eu às vezes fico deitado acordado à noite mesmo que eu esteja muito cansado	That happens to me too	Matthew10	<img src=Matthew10.png />	[sound:Level-C1-1429313265.mp3]	T_a_   h_p_e_s   t_   m_   t_o   	Isso acontece comigo também		Complete abaixo em inglês:		<img src="Tag.png">	<img src="3xwiser.png">	<img src="talk.png">	➤Level-C1 ♥08-A-Good-Night-of-Sleep ⚑Simple-Present 	Level-C1-495244760.mp3	Level-C1-1429313265.mp3				
How many hours do you need to get a good night of sleep?	Salli10	<img src='Salli10.png' />	[sound:Level-C1-1521497177.mp3]	H_w   m_n_   h_u_s   d_   y_u   n_e_   <br>t_   g_t   a   g_o_   n_g_t   <br>o_   s_e_p?   	De quantas horas você precisa para ter uma boa noite de sono?	I'm lucky I can get by on six hours of sleep considering that most people need eight	Kendra10	<img src=Kendra10.png />	[sound:Level-C1-113509367.mp3]	I'm   l_c_y   I   c_n   g_t   b_   <br>o_   s_x   h_u_s   o_   s_e_p   <br>c_n_i_e_i_g   t_a_   m_s_   p_o_l_   n_e_   <br>e_g_t   	Eu tenho sorte de conseguir ficar bem com seis horas de sono considerando que a maioria das pessoas precisam de oito		Complete abaixo em inglês:		<img src="Tag.png">	<img src="3xwiser.png">	<img src="talk.png">	➤Level-C1 ♥08-A-Good-Night-of-Sleep ⚑Clauses:-reasons-and-conditions ♚	Level-C1-1521497177.mp3	Level-C1-113509367.mp3				
I'm a light sleeper, so any little noise wakes me up. Unless I'm really tired	Kimberly10	<img src='Kimberly10.png' />	[sound:Level-C1-780893333.mp3]	I'm   a   l_g_t   s_e_p_r,   s_   a_y   <br>l_t_l_   n_i_e   w_k_s   m_   u_.   <br>U_l_s_   I'm   r_a_l_   t_r_d   	Eu sou uma pessoa de sono leve, então qualquer barulho me acorda. A não ser que eu esteja muito cansada	I'm a deep sleeper. Not even the loudest noises wake me up	John10	<img src=John10.png />	[sound:Level-C1-1902526999.mp3]	I'm   a   d_e_   s_e_p_r.   N_t   e_e_   <br>t_e   l_u_e_t   n_i_e_   w_k_   m_   <br>u_   	Eu tenho o sono pesado. Nem mesmo os sons mais barulhentos me acordam		Complete abaixo em inglês:		<img src="Tag.png">	<img src="3xwiser.png">	<img src="talk.png">	➤Level-C1 ♥08-A-Good-Night-of-Sleep ⚑Clauses:-reasons-and-conditions 	Level-C1-780893333.mp3	Level-C1-1902526999.mp3				
I can manage on five hours of sleep as long as I take a nap during the day	Matthew10	<img src='Matthew10.png' />	[sound:Level-C1-723975136.mp3]	I   c_n   m_n_g_   o_   f_v_   h_u_s   <br>o_   s_e_p   a_   l_n_   a_   <br>I   t_k_   a   n_p   d_r_n_   <br>t_e   d_y   	Eu consigo me virar com cinco horas de sono desde que eu tire uma soneca durante o dia	I don't have time to take a nap during the day, so I have to sleep for at least 8 hours a night	John10	<img src=John10.png />	[sound:Level-C1-1667353761.mp3]	I   d_n't   h_v_   t_m_   t_   t_k_   <br>a   n_p   d_r_n_   t_e   d_y,   <br>s_   I   h_v_   t_   s_e_p   <br>f_r   a_   l_a_t   8   h_u_s   <br>a   n_g_t   	Eu não tenho tempo de tirar uma soneca durante o dia, então tenho que dormir pelo menos 8 horas por noite		Complete abaixo em inglês:		<img src="Tag.png">	<img src="3xwiser.png">	<img src="talk.png">	➤Level-C1 ♥08-A-Good-Night-of-Sleep ⚑Clauses:-reasons-and-conditions ♚	Level-C1-723975136.mp3	Level-C1-1667353761.mp3				
Unless I get a good night of sleep I can easily fall asleep at work or even while driving	Ana10	<img src='Ana10.png' />	[sound:Level-C1-1525948113.mp3]	U_l_s_   I   g_t   a   g_o_   n_g_t   <br>o_   s_e_p   I   c_n   e_s_l_   <br>f_l_   a_l_e_   a_   w_r_   o_   <br>e_e_   w_i_e   d_i_i_g   	A não ser que eu tenha uma boa noite de sono eu posso facilmente pegar no sono no trabalho ou até mesmo enquanto dirigo	Then, you should always manage to have a good night of sleep, you don't want to be involved in a car accident	Kendra10	<img src=Kendra10.png />	[sound:Level-C1-51139650.mp3]	T_e_,   y_u   s_o_l_   a_w_y_   m_n_g_   t_   <br>h_v_   a   g_o_   n_g_t   o_   <br>s_e_p,   y_u   d_n't   w_n_   t_   <br>b_   i_v_l_e_   i_   a   c_r   <br>a_c_d_n_   	Você deve dar um jeito de sempre ter uma boa noite de sono, então. Você não iria querer se envolver em um acidente de carro		Complete abaixo em inglês:		<img src="Tag.png">	<img src="3xwiser.png">	<img src="talk.png">	➤Level-C1 ♥08-A-Good-Night-of-Sleep ⚑Clauses:-reasons-and-conditions 	Level-C1-1525948113.mp3	Level-C1-51139650.mp3				
What do you do to wake up right on time?	Eva10	<img src='Eva10.png' />	[sound:Level-C1-786239624.mp3]	W_a_   d_   y_u   d_   t_   w_k_   <br>u_   r_g_t   o_   t_m_?   	O que você faz para acordar na hora certa?	I always set two alarm clocks. Just in case one of them doesn't go off	Justin10	<img src=Justin10.png />	[sound:Level-C1-1097682286.mp3]	I   a_w_y_   s_t   t_o   a_a_m   c_o_k_.   <br>J_s_   i_   c_s_   o_e   o_   <br>t_e_   d_e_n't   g_   o_f   	Eu sempre programo dois relógios alarme. Somente em caso de um deles não disparar		Complete abaixo em inglês:		<img src="Tag.png">	<img src="3xwiser.png">	<img src="talk.png">	➤Level-C1 ♥08-A-Good-Night-of-Sleep ⚑Clauses:-reasons-and-conditions 	Level-C1-786239624.mp3	Level-C1-1097682286.mp3				
Do you always have to wake up early?	Salli10	<img src='Salli10.png' />	[sound:Level-C1-973756776.mp3]	D_   y_u   a_w_y_   h_v_   t_   w_k_   <br>u_   e_r_y?   	Você tem que acordar cedo sempre?	No, I don't. I only wake up very early in the morning if I have somewhere to be	Eva10	<img src=Eva10.png />	[sound:Level-C1-899475746.mp3]	N_,   I   d_n't.   I   o_l_   w_k_   <br>u_   v_r_   e_r_y   i_   t_e   <br>m_r_i_g   i_   I   h_v_   s_m_w_e_e   <br>t_   b_   	Não, eu não tenho. Eu só acordo bem cedo de manhã se eu tiver que estar em algum lugar		Complete abaixo em inglês:		<img src="Tag.png">	<img src="3xwiser.png">	<img src="talk.png">	➤Level-C1 ♥08-A-Good-Night-of-Sleep ⚑Clauses:-reasons-and-conditions 	Level-C1-973756776.mp3	Level-C1-899475746.mp3				
I'm exhausted every morning even if I slept great at night	Salli10	<img src='Salli10.png' />	[sound:Level-C1-1701017702.mp3]	I'm   e_h_u_t_d   e_e_y   m_r_i_g   e_e_   i_   <br>I   s_e_t   g_e_t   a_   n_g_t   <br>	Eu estou exausta todas as manhãs mesmo que eu tenha dormido bem a noite	You should see a doctor. This is not common	Ana10	<img src=Ana10.png />	[sound:Level-C1-2110887617.mp3]	Y_u   s_o_l_   s_e   a   d_c_o_.   T_i_   <br>i_   n_t   c_m_o_   	Você deveria ir ao médico. Isso não é normal		Complete abaixo em inglês:		<img src="Tag.png">	<img src="3xwiser.png">	<img src="talk.png">	➤Level-C1 ♥08-A-Good-Night-of-Sleep ⚑Clauses:-reasons-and-conditions 	Level-C1-1701017702.mp3	Level-C1-2110887617.mp3				
Do you ever take a power nap after lunch?	John10	<img src='John10.png' />	[sound:Level-C1-570346120.mp3]	D_   y_u   e_e_   t_k_   a   p_w_r   <br>n_p   a_t_r   l_n_h?   	Você sempre tira uma soneca "poderosa" depois do almoço?	Not really! Whenever I try to take a nap, I end up sleeping for hours	Matthew10	<img src=Matthew10.png />	[sound:Level-C1-1104640107.mp3]	N_t   r_a_l_!   W_e_e_e_   I   t_y   t_   <br>t_k_   a   n_p,   I   e_d   <br>u_   s_e_p_n_   f_r   h_u_s   	Na verdade não! Sempre que eu tento tirar uma soneca eu acabo dormindo por horas		Complete abaixo em inglês:		<img src="Tag.png">	<img src="3xwiser.png">	<img src="talk.png">	➤Level-C1 ♥08-A-Good-Night-of-Sleep ⚑Clauses:-reasons-and-conditions ♚	Level-C1-570346120.mp3	Level-C1-1104640107.mp3				
What do you do when you feel drowsy after lunch?	John10	<img src='John10.png' />	[sound:Level-C1-485661274.mp3]	W_a_   d_   y_u   d_   w_e_   y_u   <br>f_e_   d_o_s_   a_t_r   l_n_h?   	O que você faz quando você se sente sonolento depois do almoço?	I usually have a cup of coffee and have something sweet	Matthew10	<img src=Matthew10.png />	[sound:Level-C1-205417649.mp3]	I   u_u_l_y   h_v_   a   c_p   o_   <br>c_f_e_   a_d   h_v_   s_m_t_i_g   s_e_t   <br>	Eu geralmente tomo uma xícara de café e como alguma coisa doce		Complete abaixo em inglês:		<img src="Tag.png">	<img src="3xwiser.png">	<img src="talk.png">	➤Level-C1 ♥08-A-Good-Night-of-Sleep ⚑Clauses:-reasons-and-conditions 	Level-C1-485661274.mp3	Level-C1-205417649.mp3				
Drivers can fall asleep on the highway unless they rest before long trips	Kendra10	<img src='Kendra10.png' />	[sound:Level-C1-144529571.mp3]	D_i_e_s   c_n   f_l_   a_l_e_   o_   t_e   <br>h_g_w_y   u_l_s_   t_e_   r_s_   b_f_r_   <br>l_n_   t_i_s   	Motoristas podem pegar no sono na rodovia a não ser que eles descansem antes de viagens longas	That's true, my uncle is a truck driver and he always sleeps well before taking a long trip	Salli10	<img src=Salli10.png />	[sound:Level-C1-747795499.mp3]	T_a_'_   t_u_,   m_   u_c_e   i_   a   <br>t_u_k   d_i_e_   a_d   h_   a_w_y_   <br>s_e_p_   w_l_   b_f_r_   t_k_n_   a   <br>l_n_   t_i_   	Isso é verdade, meu tio é motorista de caminhão e ele sempre dorme bem antes de fazer uma longa viagem		Complete abaixo em inglês:		<img src="Tag.png">	<img src="3xwiser.png">	<img src="talk.png">	➤Level-C1 ♥08-A-Good-Night-of-Sleep ⚑Clauses:-reasons-and-conditions ♚	Level-C1-144529571.mp3	Level-C1-747795499.mp3				
What do you do when you can't sleep?	Ana10	<img src='Ana10.png' />	[sound:Level-C1-1829561269.mp3]	W_a_   d_   y_u   d_   w_e_   y_u   <br>c_n't   s_e_p?   	O que você faz quando não consegue dormir?	Sometimes when I can't get to sleep I take a bath before bed	Salli10	<img src=Salli10.png />	[sound:Level-C1-798576697.mp3]	S_m_t_m_s   w_e_   I   c_n't   g_t   t_   <br>s_e_p   I   t_k_   a   b_t_   <br>b_f_r_   b_d   	As vezes que eu não consigo pegar no sono eu tomo um banho antes de deitar		Complete abaixo em inglês:		<img src="Tag.png">	<img src="3xwiser.png">	<img src="talk.png">	➤Level-C1 ♥08-A-Good-Night-of-Sleep ⚑Clauses:-reasons-and-conditions 	Level-C1-1829561269.mp3	Level-C1-798576697.mp3				
